{"$schema":"packages/course-v2/schemas/course-v2.schema.json","courseFormat":2,"fallbackV1":{"bytes":496840,"format":1,"packUrl":"courses/puttom/pack.bin","sha256":"2e07d11db74efe05ad92959bd6b7acae97cb8f55e8b526ca8058315ee6077475"},"groundFormat":2,"groundId":"puttom","groundManifest":{"bytes":257425,"mediaType":"application/vnd.banvy.ground-manifest-v2+json","sha256":"03ede20edcaf0c5a861d8cf81341802d7fc2d675e26d2d0ab5355b045f6a46ef","url":"grounds/puttom/ground-v2-03ede20edcaf0c5a861d8cf81341802d7fc2d675e26d2d0ab5355b045f6a46ef.json"},"holes":[{"accuracyTier":"unrated","number":1,"par":4,"strokeIndex":15,"strokeIndexStatus":"verified","tileIds":["l0/3/0","l0/3/1","l0/3/2","l0/4/1","l0/4/2"]},{"accuracyTier":"unrated","number":2,"par":4,"strokeIndex":5,"strokeIndexStatus":"verified","tileIds":["l0/2/0","l0/2/1","l0/3/0","l0/3/1"]},{"accuracyTier":"unrated","number":3,"par":3,"strokeIndex":17,"strokeIndexStatus":"verified","tileIds":["l0/1/1","l0/2/0","l0/2/1"]},{"accuracyTier":"unrated","number":4,"par":5,"strokeIndex":3,"strokeIndexStatus":"verified","tileIds":["l0/2/1","l0/2/2","l0/3/1","l0/3/2"]},{"accuracyTier":"unrated","number":5,"par":3,"strokeIndex":11,"strokeIndexStatus":"verified","tileIds":["l0/4/1","l0/4/2","l0/5/1","l0/5/2"]},{"accuracyTier":"unrated","number":6,"par":4,"strokeIndex":7,"strokeIndexStatus":"verified","tileIds":["l0/4/1","l0/4/2","l0/5/1","l0/5/2","l0/6/1","l0/6/2"]},{"accuracyTier":"unrated","number":7,"par":4,"strokeIndex":1,"strokeIndexStatus":"verified","tileIds":["l0/5/2","l0/5/3","l0/5/4","l0/6/2","l0/6/3","l0/6/4"]},{"accuracyTier":"unrated","number":8,"par":4,"strokeIndex":13,"strokeIndexStatus":"verified","tileIds":["l0/5/2","l0/5/3","l0/5/4","l0/6/2","l0/6/3"]},{"accuracyTier":"unrated","number":9,"par":5,"strokeIndex":9,"strokeIndexStatus":"verified","tileIds":["l0/3/2","l0/4/2","l0/5/2","l0/6/2"]},{"accuracyTier":"unrated","number":10,"par":4,"strokeIndex":2,"strokeIndexStatus":"verified","tileIds":["l0/3/2","l0/4/2","l0/4/3","l0/5/2","l0/5/3"]},{"accuracyTier":"unrated","number":11,"par":4,"strokeIndex":12,"strokeIndexStatus":"verified","tileIds":["l0/4/3","l0/4/4","l0/5/2","l0/5/3","l0/5/4"]},{"accuracyTier":"unrated","number":12,"par":3,"strokeIndex":18,"strokeIndexStatus":"verified","tileIds":["l0/4/4","l0/4/5","l0/5/4","l0/5/5"]},{"accuracyTier":"unrated","number":13,"par":5,"strokeIndex":8,"strokeIndexStatus":"verified","tileIds":["l0/4/2","l0/4/3","l0/4/4","l0/5/2","l0/5/3","l0/5/4"]},{"accuracyTier":"unrated","number":14,"par":5,"strokeIndex":10,"strokeIndexStatus":"verified","tileIds":["l0/3/2","l0/3/3","l0/3/4","l0/4/2","l0/4/3","l0/4/4"]},{"accuracyTier":"unrated","number":15,"par":3,"strokeIndex":14,"strokeIndexStatus":"verified","tileIds":["l0/3/4","l0/3/5","l0/4/4","l0/4/5"]},{"accuracyTier":"unrated","number":16,"par":4,"strokeIndex":6,"strokeIndexStatus":"verified","tileIds":["l0/2/5","l0/2/6","l0/3/5","l0/3/6","l0/4/5","l0/4/6"]},{"accuracyTier":"unrated","number":17,"par":4,"strokeIndex":4,"strokeIndexStatus":"verified","tileIds":["l0/3/3","l0/3/4","l0/3/5"]},{"accuracyTier":"unrated","number":18,"par":4,"strokeIndex":16,"strokeIndexStatus":"verified","tileIds":["l0/3/2","l0/3/3","l0/3/4","l0/4/2","l0/4/3"]}],"requiredFeatures":["chunk-envelope-v2","course-routing-json-v1","object-registry-json-v1","stand-field-u8-v1","terrain-grid-u16-v1"],"routing":{"bytes":1640,"decodedBytes":2709,"decodedSha256":"068fceb84801a740c7375dfd61223c0462564b8515403d29642c26721d2c7b5d","kind":"routing","mediaType":"application/vnd.banvy.chunk-v2","requiredFeatures":["chunk-envelope-v2","course-routing-json-v1"],"sha256":"e4092299e3a241c8c4c154a8581f51dfa7406869c30e1e1e5c86cbafd4b24cd8","url":"courses/puttom/routing/e4092299e3a241c8c4c154a8581f51dfa7406869c30e1e1e5c86cbafd4b24cd8.bvch"},"schemaVersion":2,"slug":"puttom"}