{"$schema":"packages/course-v2/schemas/course-v2.schema.json","courseFormat":2,"fallbackV1":{"bytes":375304,"format":1,"packUrl":"courses/johannesberg/pack.bin","sha256":"036ecce0224ceb23587bb5971021b927e277050b250b5ace89ce2d1386e03621"},"groundFormat":2,"groundId":"johannesberg","groundManifest":{"bytes":112059,"mediaType":"application/vnd.banvy.ground-manifest-v2+json","sha256":"0fc53e1db1b79cd89ff399e163259bed72faa85463549ee8d68cf23e8101028d","url":"grounds/johannesberg/ground-v2-0fc53e1db1b79cd89ff399e163259bed72faa85463549ee8d68cf23e8101028d.json"},"holes":[{"accuracyTier":"D","number":1,"par":4,"strokeIndex":17,"strokeIndexStatus":"unverified","tileIds":["l0/3/0","l0/3/1","l0/3/2","l0/4/1","l0/4/2"]},{"accuracyTier":"D","number":2,"par":4,"strokeIndex":11,"strokeIndexStatus":"unverified","tileIds":["l0/3/1","l0/3/2","l0/3/3","l0/4/1","l0/4/2","l0/4/3"]},{"accuracyTier":"D","number":3,"par":5,"strokeIndex":7,"strokeIndexStatus":"unverified","tileIds":["l0/3/2","l0/3/3","l0/4/2","l0/4/3","l0/5/2","l0/5/3"]},{"accuracyTier":"D","number":4,"par":4,"strokeIndex":1,"strokeIndexStatus":"unverified","tileIds":["l0/5/2","l0/5/3","l0/6/3","l0/7/3"]},{"accuracyTier":"D","number":5,"par":4,"strokeIndex":3,"strokeIndexStatus":"unverified","tileIds":["l0/5/3","l0/5/4","l0/6/3","l0/6/4","l0/7/3","l0/7/4"]},{"accuracyTier":"D","number":6,"par":3,"strokeIndex":9,"strokeIndexStatus":"unverified","tileIds":["l0/4/4","l0/5/4","l0/5/5","l0/6/4","l0/6/5"]},{"accuracyTier":"D","number":7,"par":5,"strokeIndex":5,"strokeIndexStatus":"unverified","tileIds":["l0/4/4","l0/4/5","l0/5/4","l0/5/5","l0/5/6","l0/6/4","l0/6/5","l0/6/6"]},{"accuracyTier":"D","number":8,"par":4,"strokeIndex":13,"strokeIndexStatus":"unverified","tileIds":["l0/4/6","l0/4/7","l0/5/6","l0/5/7"]},{"accuracyTier":"D","number":9,"par":3,"strokeIndex":15,"strokeIndexStatus":"unverified","tileIds":["l0/4/6","l0/4/7"]},{"accuracyTier":"D","number":10,"par":4,"strokeIndex":8,"strokeIndexStatus":"unverified","tileIds":["l0/2/5","l0/2/6","l0/3/5","l0/3/6","l0/3/7","l0/4/6","l0/4/7"]},{"accuracyTier":"D","number":11,"par":4,"strokeIndex":16,"strokeIndexStatus":"unverified","tileIds":["l0/2/5","l0/2/6","l0/3/5","l0/3/6","l0/4/5"]},{"accuracyTier":"D","number":12,"par":4,"strokeIndex":6,"strokeIndexStatus":"unverified","tileIds":["l0/3/5","l0/4/5","l0/5/5"]},{"accuracyTier":"D","number":13,"par":3,"strokeIndex":18,"strokeIndexStatus":"unverified","tileIds":["l0/4/4","l0/4/5","l0/5/4","l0/5/5"]},{"accuracyTier":"D","number":14,"par":4,"strokeIndex":12,"strokeIndexStatus":"unverified","tileIds":["l0/3/4","l0/3/5","l0/4/4","l0/4/5","l0/5/4","l0/5/5"]},{"accuracyTier":"D","number":15,"par":4,"strokeIndex":2,"strokeIndexStatus":"unverified","tileIds":["l0/3/4","l0/3/5","l0/4/4","l0/4/5","l0/5/4"]},{"accuracyTier":"D","number":16,"par":5,"strokeIndex":10,"strokeIndexStatus":"unverified","tileIds":["l0/3/3","l0/3/4","l0/4/3","l0/4/4","l0/5/3","l0/5/4"]},{"accuracyTier":"D","number":17,"par":3,"strokeIndex":14,"strokeIndexStatus":"unverified","tileIds":["l0/3/2","l0/3/3","l0/4/2"]},{"accuracyTier":"D","number":18,"par":5,"strokeIndex":4,"strokeIndexStatus":"unverified","tileIds":["l0/2/0","l0/2/1","l0/2/2","l0/3/0","l0/3/1","l0/3/2"]}],"requiredFeatures":["chunk-envelope-v2","course-routing-json-v1","object-registry-json-v1","stand-field-u8-v1","terrain-grid-u16-v1"],"routing":{"bytes":2300,"decodedBytes":4249,"decodedSha256":"0d4ce21eccdccfa978a8212ed16f118a90921108e866555bd8213fc5d4fcbfbc","kind":"routing","mediaType":"application/vnd.banvy.chunk-v2","requiredFeatures":["chunk-envelope-v2","course-routing-json-v1"],"sha256":"5ed93423670599873fe0a1f29072d32baf47f73c15b0b76e59e5a0f9bd249bc7","url":"courses/johannesberg/routing/5ed93423670599873fe0a1f29072d32baf47f73c15b0b76e59e5a0f9bd249bc7.bvch"},"schemaVersion":2,"slug":"johannesberg"}