{"$schema":"packages/course-v2/schemas/course-v2.schema.json","courseFormat":2,"fallbackV1":{"bytes":681373,"format":1,"packUrl":"courses/upsala-mellanbanan/pack.bin","sha256":"48d09b9c96cf836921d014106aa1f3bbc4452d3f5a8b4202651b2c5887e7e478"},"groundFormat":2,"groundId":"upsala","groundManifest":{"bytes":208673,"mediaType":"application/vnd.banvy.ground-manifest-v2+json","sha256":"bdac03b72430a0bad7a4e1cbf6511f52c46c4c878e72f53615432807c54440e2","url":"grounds/upsala/ground-v2-bdac03b72430a0bad7a4e1cbf6511f52c46c4c878e72f53615432807c54440e2.json"},"holes":[{"accuracyTier":"unrated","number":1,"par":4,"strokeIndex":9,"strokeIndexStatus":"unverified","tileIds":["l0/3/2","l0/3/3","l0/4/2","l0/4/3"]},{"accuracyTier":"unrated","number":2,"par":4,"strokeIndex":7,"strokeIndexStatus":"unverified","tileIds":["l0/4/2","l0/4/3","l0/5/2","l0/5/3","l0/6/3"]},{"accuracyTier":"unrated","number":3,"par":5,"strokeIndex":5,"strokeIndexStatus":"unverified","tileIds":["l0/5/2","l0/5/3","l0/6/2","l0/6/3","l0/7/2","l0/7/3"]},{"accuracyTier":"unrated","number":4,"par":4,"strokeIndex":11,"strokeIndexStatus":"unverified","tileIds":["l0/5/3","l0/6/3","l0/7/3"]},{"accuracyTier":"unrated","number":5,"par":3,"strokeIndex":17,"strokeIndexStatus":"unverified","tileIds":["l0/5/3","l0/5/4","l0/6/3","l0/6/4"]},{"accuracyTier":"unrated","number":6,"par":5,"strokeIndex":3,"strokeIndexStatus":"unverified","tileIds":["l0/4/4","l0/4/5","l0/5/4","l0/5/5","l0/6/4","l0/6/5"]},{"accuracyTier":"unrated","number":7,"par":3,"strokeIndex":15,"strokeIndexStatus":"unverified","tileIds":["l0/4/4","l0/4/5","l0/5/4","l0/5/5"]},{"accuracyTier":"unrated","number":8,"par":4,"strokeIndex":1,"strokeIndexStatus":"unverified","tileIds":["l0/4/3","l0/4/4","l0/4/5","l0/5/3","l0/5/4","l0/5/5"]},{"accuracyTier":"unrated","number":9,"par":3,"strokeIndex":13,"strokeIndexStatus":"unverified","tileIds":["l0/3/2","l0/3/3","l0/4/2","l0/4/3"]}],"requiredFeatures":["chunk-envelope-v2","course-routing-json-v1","terrain-grid-u16-v1"],"routing":{"bytes":1534,"decodedBytes":2210,"decodedSha256":"8b5a789a8d69d22de8ae453ab672e4c2ada35e186e294e7ce2ec8fe1fcbd02be","kind":"routing","mediaType":"application/vnd.banvy.chunk-v2","requiredFeatures":["chunk-envelope-v2","course-routing-json-v1"],"sha256":"2e48811092e4413ff7de286bd3d187228ac92f0bbba5bc8f01e4e48cc644a37a","url":"courses/upsala-mellanbanan/routing/2e48811092e4413ff7de286bd3d187228ac92f0bbba5bc8f01e4e48cc644a37a.bvch"},"schemaVersion":2,"slug":"upsala-mellanbanan"}