{"$schema":"packages/course-v2/schemas/course-v2.schema.json","courseFormat":2,"fallbackV1":{"bytes":186036,"format":1,"packUrl":"courses/ribbingsfors/pack.bin","sha256":"3baac2fdb190899ce06bb6ad73d2f83889933d7e33db15410575362ec72de423"},"groundFormat":2,"groundId":"ribbingsfors","groundManifest":{"bytes":115579,"mediaType":"application/vnd.banvy.ground-manifest-v2+json","sha256":"ca1b159e05f263f4375099211569e60a7568a63e2d58ac3bd6090692ea977b6e","url":"grounds/ribbingsfors/ground-v2-ca1b159e05f263f4375099211569e60a7568a63e2d58ac3bd6090692ea977b6e.json"},"holes":[{"accuracyTier":"D","number":1,"par":4,"strokeIndex":11,"strokeIndexStatus":"unverified","tileIds":["l0/5/1","l0/5/2","l0/5/3","l0/6/1","l0/6/2","l0/6/3"]},{"accuracyTier":"D","number":2,"par":3,"strokeIndex":13,"strokeIndexStatus":"unverified","tileIds":["l0/5/3","l0/5/4","l0/6/3","l0/6/4"]},{"accuracyTier":"D","number":3,"par":4,"strokeIndex":1,"strokeIndexStatus":"unverified","tileIds":["l0/5/4","l0/5/5","l0/6/3","l0/6/4","l0/6/5"]},{"accuracyTier":"D","number":4,"par":4,"strokeIndex":7,"strokeIndexStatus":"unverified","tileIds":["l0/5/4","l0/5/5","l0/6/4","l0/6/5"]},{"accuracyTier":"D","number":5,"par":5,"strokeIndex":5,"strokeIndexStatus":"unverified","tileIds":["l0/3/4","l0/3/5","l0/4/4","l0/5/4"]},{"accuracyTier":"D","number":6,"par":4,"strokeIndex":9,"strokeIndexStatus":"unverified","tileIds":["l0/2/4","l0/2/5","l0/3/3","l0/3/4","l0/3/5","l0/4/3","l0/4/4"]},{"accuracyTier":"D","number":7,"par":4,"strokeIndex":3,"strokeIndexStatus":"unverified","tileIds":["l0/3/3","l0/3/4","l0/4/3","l0/4/4","l0/5/3","l0/5/4"]},{"accuracyTier":"D","number":8,"par":3,"strokeIndex":17,"strokeIndexStatus":"unverified","tileIds":["l0/4/3","l0/5/3","l0/6/3"]},{"accuracyTier":"D","number":9,"par":5,"strokeIndex":15,"strokeIndexStatus":"unverified","tileIds":["l0/5/1","l0/5/2","l0/5/3","l0/6/2","l0/6/3","l0/6/4"]}],"requiredFeatures":["chunk-envelope-v2","course-routing-json-v1","object-registry-json-v1","stand-field-u8-v1","terrain-grid-u16-v1"],"routing":{"bytes":1042,"decodedBytes":1194,"decodedSha256":"1ff62f6e61db6f75ad6d130c03c55f95694ea7f2a39eca2f0fd86e4b869cfca8","kind":"routing","mediaType":"application/vnd.banvy.chunk-v2","requiredFeatures":["chunk-envelope-v2","course-routing-json-v1"],"sha256":"bdaed5ee6c2203a2d04132bedfba82308d9f86faf08354cbaceaed827fb91970","url":"courses/ribbingsfors/routing/bdaed5ee6c2203a2d04132bedfba82308d9f86faf08354cbaceaed827fb91970.bvch"},"schemaVersion":2,"slug":"ribbingsfors"}