{"$schema":"packages/course-v2/schemas/course-v2.schema.json","courseFormat":2,"fallbackV1":{"bytes":337981,"format":1,"packUrl":"courses/angso/pack.bin","sha256":"f60d5b7a9a7be528c7bd715c5993748a0ee16352a466b4fe44c6dc5cd4bef0f5"},"groundFormat":2,"groundId":"angso","groundManifest":{"bytes":243032,"mediaType":"application/vnd.banvy.ground-manifest-v2+json","sha256":"cb72d76424079f219fc8f98cfc1a112bc7aaa66ec1357f52e5b240ddd7b9cd90","url":"grounds/angso/ground-v2-cb72d76424079f219fc8f98cfc1a112bc7aaa66ec1357f52e5b240ddd7b9cd90.json"},"holes":[{"accuracyTier":"D","number":1,"par":4,"strokeIndex":10,"strokeIndexStatus":"verified","tileIds":["l0/7/10","l0/7/11","l0/7/12","l0/8/10","l0/8/11"]},{"accuracyTier":"D","number":2,"par":4,"strokeIndex":6,"strokeIndexStatus":"verified","tileIds":["l0/7/11","l0/7/12","l0/8/11","l0/8/12","l0/9/11","l0/9/12"]},{"accuracyTier":"D","number":3,"par":3,"strokeIndex":8,"strokeIndexStatus":"verified","tileIds":["l0/7/11","l0/8/11","l0/8/12","l0/9/11","l0/9/12"]},{"accuracyTier":"D","number":4,"par":4,"strokeIndex":2,"strokeIndexStatus":"verified","tileIds":["l0/7/10","l0/7/11","l0/8/10","l0/8/11","l0/8/9"]},{"accuracyTier":"D","number":5,"par":5,"strokeIndex":18,"strokeIndexStatus":"verified","tileIds":["l0/8/10","l0/8/11","l0/8/9","l0/9/10","l0/9/11","l0/9/9"]},{"accuracyTier":"D","number":6,"par":4,"strokeIndex":16,"strokeIndexStatus":"verified","tileIds":["l0/10/10","l0/10/11","l0/8/10","l0/8/11","l0/8/9","l0/9/10","l0/9/11","l0/9/9"]},{"accuracyTier":"D","number":7,"par":5,"strokeIndex":4,"strokeIndexStatus":"verified","tileIds":["l0/8/10","l0/8/7","l0/8/8","l0/8/9","l0/9/10","l0/9/7","l0/9/8","l0/9/9"]},{"accuracyTier":"D","number":8,"par":4,"strokeIndex":14,"strokeIndexStatus":"verified","tileIds":["l0/8/7","l0/8/8","l0/8/9"]},{"accuracyTier":"D","number":9,"par":3,"strokeIndex":12,"strokeIndexStatus":"verified","tileIds":["l0/7/10","l0/7/9","l0/8/10","l0/8/9"]},{"accuracyTier":"D","number":10,"par":5,"strokeIndex":1,"strokeIndexStatus":"verified","tileIds":["l0/7/10","l0/7/7","l0/7/8","l0/7/9","l0/8/7","l0/8/8"]},{"accuracyTier":"D","number":11,"par":4,"strokeIndex":17,"strokeIndexStatus":"verified","tileIds":["l0/7/6","l0/7/7","l0/7/8","l0/8/6","l0/8/7","l0/8/8"]},{"accuracyTier":"D","number":12,"par":3,"strokeIndex":9,"strokeIndexStatus":"verified","tileIds":["l0/6/4","l0/6/5","l0/7/4","l0/7/5","l0/8/5"]},{"accuracyTier":"D","number":13,"par":4,"strokeIndex":5,"strokeIndexStatus":"verified","tileIds":["l0/6/3","l0/6/4","l0/6/5","l0/7/3","l0/7/4","l0/7/5"]},{"accuracyTier":"D","number":14,"par":4,"strokeIndex":11,"strokeIndexStatus":"verified","tileIds":["l0/5/3","l0/5/4","l0/6/3","l0/6/4","l0/6/5","l0/7/4","l0/7/5"]},{"accuracyTier":"D","number":15,"par":3,"strokeIndex":7,"strokeIndexStatus":"verified","tileIds":["l0/6/4","l0/6/5","l0/7/4","l0/7/5"]},{"accuracyTier":"D","number":16,"par":4,"strokeIndex":13,"strokeIndexStatus":"verified","tileIds":["l0/6/5","l0/6/6","l0/7/5","l0/7/6"]},{"accuracyTier":"D","number":17,"par":4,"strokeIndex":3,"strokeIndexStatus":"verified","tileIds":["l0/6/6","l0/6/7","l0/6/8","l0/7/6","l0/7/7","l0/7/8"]},{"accuracyTier":"D","number":18,"par":5,"strokeIndex":15,"strokeIndexStatus":"verified","tileIds":["l0/6/10","l0/6/8","l0/6/9","l0/7/10","l0/7/8","l0/7/9"]}],"requiredFeatures":["chunk-envelope-v2","course-routing-json-v1","terrain-grid-u16-v1"],"routing":{"bytes":2144,"decodedBytes":3919,"decodedSha256":"944cddfaece7afc12596c6558b3a4faf6505bfaf4b1279afe53c3f82dda48c5e","kind":"routing","mediaType":"application/vnd.banvy.chunk-v2","requiredFeatures":["chunk-envelope-v2","course-routing-json-v1"],"sha256":"14bf329a19a920db40c09216149cc964958bfdc9fc89cd9e718b920c2a0e0093","url":"courses/angso/routing/14bf329a19a920db40c09216149cc964958bfdc9fc89cd9e718b920c2a0e0093.bvch"},"schemaVersion":2,"slug":"angso"}