{"$schema":"packages/course-v2/schemas/course-v2.schema.json","courseFormat":2,"fallbackV1":{"bytes":474333,"format":1,"packUrl":"courses/lidingo/pack.bin","sha256":"580243354d3fb9f1ba6ff0cc2b2eb202ac82c5de8bd7d95cd21fb4d49a3ffac5"},"groundFormat":2,"groundId":"lidingo","groundManifest":{"bytes":235841,"mediaType":"application/vnd.banvy.ground-manifest-v2+json","sha256":"6c34361e59501575a76ffddd4a15985ec78922311e7ba6ba3c61a94687193eb7","url":"grounds/lidingo/ground-v2-6c34361e59501575a76ffddd4a15985ec78922311e7ba6ba3c61a94687193eb7.json"},"holes":[{"accuracyTier":"unrated","number":1,"par":3,"strokeIndex":14,"strokeIndexStatus":"verified","tileIds":["l0/3/3","l0/3/4","l0/4/3","l0/4/4"]},{"accuracyTier":"unrated","number":2,"par":5,"strokeIndex":6,"strokeIndexStatus":"verified","tileIds":["l0/4/4","l0/4/5","l0/4/6","l0/5/4","l0/5/5","l0/5/6"]},{"accuracyTier":"unrated","number":3,"par":3,"strokeIndex":10,"strokeIndexStatus":"verified","tileIds":["l0/4/5","l0/4/6","l0/5/5","l0/5/6"]},{"accuracyTier":"unrated","number":4,"par":4,"strokeIndex":4,"strokeIndexStatus":"verified","tileIds":["l0/3/3","l0/3/4","l0/4/3","l0/4/4","l0/4/5","l0/5/4","l0/5/5"]},{"accuracyTier":"unrated","number":5,"par":4,"strokeIndex":18,"strokeIndexStatus":"verified","tileIds":["l0/2/4","l0/2/5","l0/3/3","l0/3/4","l0/3/5"]},{"accuracyTier":"unrated","number":6,"par":3,"strokeIndex":8,"strokeIndexStatus":"verified","tileIds":["l0/2/4","l0/2/5","l0/3/4","l0/3/5","l0/4/4","l0/4/5"]},{"accuracyTier":"unrated","number":7,"par":4,"strokeIndex":2,"strokeIndexStatus":"verified","tileIds":["l0/2/4","l0/2/5","l0/3/4","l0/3/5","l0/4/5"]},{"accuracyTier":"unrated","number":8,"par":4,"strokeIndex":12,"strokeIndexStatus":"verified","tileIds":["l0/1/4","l0/1/5","l0/2/3","l0/2/4","l0/2/5","l0/3/3","l0/3/4"]},{"accuracyTier":"unrated","number":9,"par":3,"strokeIndex":16,"strokeIndexStatus":"verified","tileIds":["l0/2/3","l0/2/4","l0/3/3","l0/3/4"]},{"accuracyTier":"unrated","number":10,"par":5,"strokeIndex":7,"strokeIndexStatus":"verified","tileIds":["l0/1/2","l0/1/3","l0/2/2","l0/2/3","l0/2/4","l0/3/3","l0/3/4"]},{"accuracyTier":"unrated","number":11,"par":3,"strokeIndex":17,"strokeIndexStatus":"verified","tileIds":["l0/1/1","l0/1/2","l0/2/1","l0/2/2"]},{"accuracyTier":"unrated","number":12,"par":5,"strokeIndex":3,"strokeIndexStatus":"verified","tileIds":["l0/1/1","l0/1/2","l0/2/1","l0/2/2","l0/3/1","l0/3/2"]},{"accuracyTier":"unrated","number":13,"par":4,"strokeIndex":11,"strokeIndexStatus":"verified","tileIds":["l0/1/2","l0/2/2","l0/2/3","l0/3/2","l0/3/3"]},{"accuracyTier":"unrated","number":14,"par":4,"strokeIndex":15,"strokeIndexStatus":"verified","tileIds":["l0/1/2","l0/2/2","l0/2/3","l0/3/2","l0/3/3"]},{"accuracyTier":"unrated","number":15,"par":4,"strokeIndex":1,"strokeIndexStatus":"verified","tileIds":["l0/3/1","l0/3/2","l0/3/3","l0/4/1","l0/4/2","l0/4/3"]},{"accuracyTier":"unrated","number":16,"par":3,"strokeIndex":9,"strokeIndexStatus":"verified","tileIds":["l0/3/2","l0/3/3","l0/4/1","l0/4/2","l0/4/3"]},{"accuracyTier":"unrated","number":17,"par":5,"strokeIndex":13,"strokeIndexStatus":"verified","tileIds":["l0/3/2","l0/3/3","l0/4/2","l0/4/3","l0/5/2","l0/5/3"]},{"accuracyTier":"unrated","number":18,"par":4,"strokeIndex":5,"strokeIndexStatus":"verified","tileIds":["l0/3/3","l0/4/3","l0/4/4","l0/5/2","l0/5/3","l0/5/4","l0/6/2","l0/6/3"]}],"requiredFeatures":["chunk-envelope-v2","course-routing-json-v1","stand-field-u8-v1","terrain-grid-u16-v1"],"routing":{"bytes":1678,"decodedBytes":2712,"decodedSha256":"9704e09ca4457fc7010fdf6bfb3d3fad7697f57a9657eb741b16b71234dd976f","kind":"routing","mediaType":"application/vnd.banvy.chunk-v2","requiredFeatures":["chunk-envelope-v2","course-routing-json-v1"],"sha256":"e499268b0ab1f381f6420038af92b0e4ea656a29402809e962055eeb96d3eeea","url":"courses/lidingo/routing/e499268b0ab1f381f6420038af92b0e4ea656a29402809e962055eeb96d3eeea.bvch"},"schemaVersion":2,"slug":"lidingo"}