{"$schema":"packages/course-v2/schemas/course-v2.schema.json","courseFormat":2,"fallbackV1":{"bytes":368039,"format":1,"packUrl":"courses/veckefjarden/pack.bin","sha256":"77e76fc8e4e77e537d6b0d6c8ad17b0ebefe4bc2bfa54b5e6916f699ec8fdd0d"},"groundFormat":2,"groundId":"veckefjarden","groundManifest":{"bytes":577099,"mediaType":"application/vnd.banvy.ground-manifest-v2+json","sha256":"0023441c37757a3f81cd257d898d7837986106593b59d02cfe37a9380f6162dd","url":"grounds/veckefjarden/ground-v2-0023441c37757a3f81cd257d898d7837986106593b59d02cfe37a9380f6162dd.json"},"holes":[{"accuracyTier":"unrated","number":1,"par":4,"strokeIndex":8,"strokeIndexStatus":"verified","tileIds":["l0/8/8","l0/8/9","l0/9/10","l0/9/8","l0/9/9"]},{"accuracyTier":"unrated","number":2,"par":5,"strokeIndex":18,"strokeIndexStatus":"verified","tileIds":["l0/10/10","l0/10/9","l0/7/10","l0/7/11","l0/8/10","l0/8/11","l0/8/9","l0/9/10","l0/9/9"]},{"accuracyTier":"unrated","number":3,"par":4,"strokeIndex":4,"strokeIndexStatus":"verified","tileIds":["l0/7/10","l0/8/10","l0/8/9","l0/9/10","l0/9/9"]},{"accuracyTier":"unrated","number":4,"par":3,"strokeIndex":10,"strokeIndexStatus":"verified","tileIds":["l0/7/10","l0/7/9","l0/8/10","l0/8/9","l0/9/9"]},{"accuracyTier":"unrated","number":5,"par":5,"strokeIndex":14,"strokeIndexStatus":"verified","tileIds":["l0/7/10","l0/7/8","l0/7/9","l0/8/10","l0/8/8","l0/8/9"]},{"accuracyTier":"unrated","number":6,"par":4,"strokeIndex":2,"strokeIndexStatus":"verified","tileIds":["l0/6/6","l0/6/7","l0/7/6","l0/7/7","l0/7/8","l0/8/7","l0/8/8"]},{"accuracyTier":"unrated","number":7,"par":3,"strokeIndex":16,"strokeIndexStatus":"verified","tileIds":["l0/6/6","l0/6/7","l0/7/6","l0/7/7"]},{"accuracyTier":"unrated","number":8,"par":4,"strokeIndex":12,"strokeIndexStatus":"verified","tileIds":["l0/6/5","l0/6/6","l0/7/5","l0/7/6","l0/8/6"]},{"accuracyTier":"unrated","number":9,"par":4,"strokeIndex":6,"strokeIndexStatus":"verified","tileIds":["l0/7/6","l0/7/7","l0/8/6","l0/8/7","l0/9/6","l0/9/7","l0/9/8"]},{"accuracyTier":"unrated","number":10,"par":5,"strokeIndex":9,"strokeIndexStatus":"verified","tileIds":["l0/7/5","l0/7/6","l0/8/5","l0/8/6","l0/8/7","l0/9/6","l0/9/7"]},{"accuracyTier":"unrated","number":11,"par":4,"strokeIndex":15,"strokeIndexStatus":"verified","tileIds":["l0/6/4","l0/6/5","l0/7/4","l0/7/5","l0/7/6","l0/8/5","l0/8/6"]},{"accuracyTier":"unrated","number":12,"par":3,"strokeIndex":11,"strokeIndexStatus":"verified","tileIds":["l0/5/5","l0/6/5","l0/6/6","l0/7/5","l0/7/6"]},{"accuracyTier":"unrated","number":13,"par":4,"strokeIndex":1,"strokeIndexStatus":"verified","tileIds":["l0/5/4","l0/5/5","l0/6/4","l0/6/5","l0/6/6","l0/7/5","l0/7/6"]},{"accuracyTier":"unrated","number":14,"par":3,"strokeIndex":5,"strokeIndexStatus":"verified","tileIds":["l0/6/6","l0/6/7"]},{"accuracyTier":"unrated","number":15,"par":4,"strokeIndex":13,"strokeIndexStatus":"verified","tileIds":["l0/6/6","l0/6/7","l0/6/8","l0/7/6","l0/7/7","l0/7/8"]},{"accuracyTier":"unrated","number":16,"par":4,"strokeIndex":17,"strokeIndexStatus":"verified","tileIds":["l0/7/7","l0/7/8","l0/8/7","l0/8/8","l0/9/7","l0/9/8"]},{"accuracyTier":"unrated","number":17,"par":4,"strokeIndex":3,"strokeIndexStatus":"verified","tileIds":["l0/6/6","l0/6/7","l0/7/6","l0/7/7","l0/8/6","l0/8/7","l0/8/8"]},{"accuracyTier":"unrated","number":18,"par":5,"strokeIndex":7,"strokeIndexStatus":"verified","tileIds":["l0/7/6","l0/7/7","l0/8/6","l0/8/7","l0/8/8","l0/9/7","l0/9/8"]}],"requiredFeatures":["chunk-envelope-v2","course-routing-json-v1","object-registry-json-v1","stand-field-u8-v1","terrain-grid-u16-v1"],"routing":{"bytes":1645,"decodedBytes":2567,"decodedSha256":"096e5bd552844235c84cc4f5b00f6e435d200153d89e5c196d4d4d537dbeba89","kind":"routing","mediaType":"application/vnd.banvy.chunk-v2","requiredFeatures":["chunk-envelope-v2","course-routing-json-v1"],"sha256":"b36b064b450d323acf663a5ec4978532dd65b5e83d33b3b7e0ffd50de1ccefcb","url":"courses/veckefjarden/routing/b36b064b450d323acf663a5ec4978532dd65b5e83d33b3b7e0ffd50de1ccefcb.bvch"},"schemaVersion":2,"slug":"veckefjarden"}