{"$schema":"packages/course-v2/schemas/course-v2.schema.json","courseFormat":2,"fallbackV1":{"bytes":481863,"format":1,"packUrl":"courses/angso/pack.bin","sha256":"778f8b2933599fbf9145f57d8ab2608c222ce501b275a39c913aadbe1e504c09"},"groundFormat":2,"groundId":"angso","groundManifest":{"bytes":552653,"mediaType":"application/vnd.banvy.ground-manifest-v2+json","sha256":"0327367adaf0561e23b19292aa549e92dc53c880f39bee8fc10d2524a4dc67ec","url":"grounds/angso/ground-v2-0327367adaf0561e23b19292aa549e92dc53c880f39bee8fc10d2524a4dc67ec.json"},"holes":[{"accuracyTier":"unrated","number":1,"par":4,"strokeIndex":10,"strokeIndexStatus":"verified","tileIds":["l0/7/10","l0/7/11","l0/7/12","l0/8/10","l0/8/11"]},{"accuracyTier":"unrated","number":2,"par":4,"strokeIndex":6,"strokeIndexStatus":"verified","tileIds":["l0/7/11","l0/7/12","l0/8/11","l0/8/12","l0/9/11","l0/9/12"]},{"accuracyTier":"unrated","number":3,"par":3,"strokeIndex":8,"strokeIndexStatus":"verified","tileIds":["l0/7/11","l0/8/11","l0/8/12","l0/9/11","l0/9/12"]},{"accuracyTier":"unrated","number":4,"par":4,"strokeIndex":2,"strokeIndexStatus":"verified","tileIds":["l0/7/10","l0/7/11","l0/8/10","l0/8/11","l0/8/9"]},{"accuracyTier":"unrated","number":5,"par":5,"strokeIndex":18,"strokeIndexStatus":"verified","tileIds":["l0/8/10","l0/8/11","l0/8/9","l0/9/10","l0/9/11","l0/9/9"]},{"accuracyTier":"unrated","number":6,"par":4,"strokeIndex":16,"strokeIndexStatus":"verified","tileIds":["l0/10/10","l0/10/11","l0/8/10","l0/8/11","l0/8/9","l0/9/10","l0/9/11","l0/9/9"]},{"accuracyTier":"unrated","number":7,"par":5,"strokeIndex":4,"strokeIndexStatus":"verified","tileIds":["l0/8/10","l0/8/7","l0/8/8","l0/8/9","l0/9/10","l0/9/7","l0/9/8","l0/9/9"]},{"accuracyTier":"unrated","number":8,"par":4,"strokeIndex":14,"strokeIndexStatus":"verified","tileIds":["l0/8/7","l0/8/8","l0/8/9"]},{"accuracyTier":"unrated","number":9,"par":3,"strokeIndex":12,"strokeIndexStatus":"verified","tileIds":["l0/7/10","l0/7/9","l0/8/10","l0/8/9"]},{"accuracyTier":"unrated","number":10,"par":5,"strokeIndex":1,"strokeIndexStatus":"verified","tileIds":["l0/7/10","l0/7/7","l0/7/8","l0/7/9","l0/8/7","l0/8/8"]},{"accuracyTier":"unrated","number":11,"par":4,"strokeIndex":17,"strokeIndexStatus":"verified","tileIds":["l0/7/6","l0/7/7","l0/7/8","l0/8/6","l0/8/7","l0/8/8"]},{"accuracyTier":"unrated","number":12,"par":3,"strokeIndex":9,"strokeIndexStatus":"verified","tileIds":["l0/6/4","l0/6/5","l0/7/4","l0/7/5","l0/8/5"]},{"accuracyTier":"unrated","number":13,"par":4,"strokeIndex":5,"strokeIndexStatus":"verified","tileIds":["l0/6/3","l0/6/4","l0/6/5","l0/7/3","l0/7/4","l0/7/5"]},{"accuracyTier":"unrated","number":14,"par":4,"strokeIndex":11,"strokeIndexStatus":"verified","tileIds":["l0/5/3","l0/5/4","l0/6/3","l0/6/4","l0/6/5","l0/7/4","l0/7/5"]},{"accuracyTier":"unrated","number":15,"par":3,"strokeIndex":7,"strokeIndexStatus":"verified","tileIds":["l0/6/5","l0/7/5"]},{"accuracyTier":"unrated","number":16,"par":4,"strokeIndex":13,"strokeIndexStatus":"verified","tileIds":["l0/6/5","l0/6/6","l0/7/5","l0/7/6"]},{"accuracyTier":"unrated","number":17,"par":4,"strokeIndex":3,"strokeIndexStatus":"verified","tileIds":["l0/6/6","l0/6/7","l0/6/8","l0/7/6","l0/7/7","l0/7/8"]},{"accuracyTier":"unrated","number":18,"par":5,"strokeIndex":15,"strokeIndexStatus":"verified","tileIds":["l0/6/10","l0/6/8","l0/6/9","l0/7/10","l0/7/8","l0/7/9"]}],"requiredFeatures":["chunk-envelope-v2","course-routing-json-v1","object-registry-json-v1","stand-field-u8-v1","terrain-grid-u16-v1"],"routing":{"bytes":2140,"decodedBytes":3863,"decodedSha256":"481a2108c0319ceba5c7f030f0cf8b0ccb564fa38a4e21285f70dc7c5f94e00e","kind":"routing","mediaType":"application/vnd.banvy.chunk-v2","requiredFeatures":["chunk-envelope-v2","course-routing-json-v1"],"sha256":"12c0d97a6110f5082f4438f941d50159b2eaaab5bcf8c47527110212ffd0e7da","url":"courses/angso/routing/12c0d97a6110f5082f4438f941d50159b2eaaab5bcf8c47527110212ffd0e7da.bvch"},"schemaVersion":2,"slug":"angso"}