{"$schema":"packages/course-v2/schemas/course-v2.schema.json","courseFormat":2,"fallbackV1":{"bytes":371856,"format":1,"packUrl":"courses/johannesberg-9/pack.bin","sha256":"3bb71cc0f11f5c41705ed64bf2ea0cd32c890434e5e249b2e166a3f628c0f300"},"groundFormat":2,"groundId":"johannesberg","groundManifest":{"bytes":405432,"mediaType":"application/vnd.banvy.ground-manifest-v2+json","sha256":"1f0f72bbbac45925e255ee312e9632628f355048110c744be7a04750136709aa","url":"grounds/johannesberg/ground-v2-1f0f72bbbac45925e255ee312e9632628f355048110c744be7a04750136709aa.json"},"holes":[{"accuracyTier":"D","number":1,"par":4,"strokeIndex":5,"strokeIndexStatus":"unverified","tileIds":["l0/5/4","l0/6/4","l0/7/4"]},{"accuracyTier":"D","number":2,"par":4,"strokeIndex":11,"strokeIndexStatus":"unverified","tileIds":["l0/4/4","l0/4/5","l0/5/4","l0/5/5"]},{"accuracyTier":"D","number":3,"par":4,"strokeIndex":9,"strokeIndexStatus":"unverified","tileIds":["l0/4/4","l0/4/5","l0/5/4","l0/5/5"]},{"accuracyTier":"D","number":4,"par":3,"strokeIndex":15,"strokeIndexStatus":"unverified","tileIds":["l0/4/4","l0/5/4"]},{"accuracyTier":"D","number":5,"par":4,"strokeIndex":13,"strokeIndexStatus":"unverified","tileIds":["l0/5/4","l0/5/5","l0/6/4","l0/6/5","l0/7/4","l0/7/5"]},{"accuracyTier":"D","number":6,"par":4,"strokeIndex":3,"strokeIndexStatus":"unverified","tileIds":["l0/5/4","l0/5/5","l0/6/4","l0/6/5","l0/7/4","l0/7/5"]},{"accuracyTier":"D","number":7,"par":3,"strokeIndex":17,"strokeIndexStatus":"unverified","tileIds":["l0/4/5","l0/5/4","l0/5/5"]},{"accuracyTier":"D","number":8,"par":5,"strokeIndex":1,"strokeIndexStatus":"unverified","tileIds":["l0/5/5","l0/6/5","l0/6/6","l0/7/5","l0/7/6"]},{"accuracyTier":"D","number":9,"par":3,"strokeIndex":7,"strokeIndexStatus":"unverified","tileIds":["l0/6/4","l0/6/5","l0/7/4","l0/7/5"]}],"requiredFeatures":["chunk-envelope-v2","course-routing-json-v1","object-registry-json-v1","stand-field-u8-v1","terrain-grid-u16-v1"],"routing":{"bytes":1500,"decodedBytes":2211,"decodedSha256":"6ab34630b104d32ab41348b964ac71901c8ec37e2cf1c5b8b3a6115b8e2e6cfe","kind":"routing","mediaType":"application/vnd.banvy.chunk-v2","requiredFeatures":["chunk-envelope-v2","course-routing-json-v1"],"sha256":"dcc02175954ea8a442720410ee1250afb75b1be6cbc1fff3016cc04abec300d2","url":"courses/johannesberg-9/routing/dcc02175954ea8a442720410ee1250afb75b1be6cbc1fff3016cc04abec300d2.bvch"},"schemaVersion":2,"slug":"johannesberg-9"}