{"$schema":"packages/course-v2/schemas/course-v2.schema.json","courseFormat":2,"fallbackV1":{"bytes":527213,"format":1,"packUrl":"courses/visby/pack.bin","sha256":"03a1989f7d6f45c71240410224cb63c9face892eb0c9f7f386f055f9b168b85b"},"groundFormat":2,"groundId":"visby","groundManifest":{"bytes":500364,"mediaType":"application/vnd.banvy.ground-manifest-v2+json","sha256":"98c29c691ccf425008e62758c3710203064e6016f133eb09801c186f5a9b76f5","url":"grounds/visby/ground-v2-98c29c691ccf425008e62758c3710203064e6016f133eb09801c186f5a9b76f5.json"},"holes":[{"accuracyTier":"unrated","number":1,"par":3,"strokeIndex":15,"strokeIndexStatus":"verified","tileIds":["l0/5/7","l0/5/8","l0/6/7","l0/6/8"]},{"accuracyTier":"unrated","number":2,"par":4,"strokeIndex":7,"strokeIndexStatus":"verified","tileIds":["l0/5/7","l0/5/8","l0/6/6","l0/6/7","l0/6/8"]},{"accuracyTier":"unrated","number":3,"par":5,"strokeIndex":5,"strokeIndexStatus":"verified","tileIds":["l0/6/4","l0/6/5","l0/6/6","l0/7/4","l0/7/5","l0/7/6"]},{"accuracyTier":"unrated","number":4,"par":4,"strokeIndex":13,"strokeIndexStatus":"verified","tileIds":["l0/6/3","l0/6/4","l0/7/3","l0/7/4","l0/7/5","l0/8/4","l0/8/5"]},{"accuracyTier":"unrated","number":5,"par":3,"strokeIndex":11,"strokeIndexStatus":"verified","tileIds":["l0/6/4","l0/6/5"]},{"accuracyTier":"unrated","number":6,"par":5,"strokeIndex":3,"strokeIndexStatus":"verified","tileIds":["l0/6/4","l0/6/5","l0/6/6","l0/6/7"]},{"accuracyTier":"unrated","number":7,"par":3,"strokeIndex":9,"strokeIndexStatus":"verified","tileIds":["l0/6/6","l0/6/7","l0/7/6","l0/7/7"]},{"accuracyTier":"unrated","number":8,"par":4,"strokeIndex":1,"strokeIndexStatus":"verified","tileIds":["l0/6/6","l0/6/7","l0/6/8","l0/7/6","l0/7/7"]},{"accuracyTier":"unrated","number":9,"par":4,"strokeIndex":17,"strokeIndexStatus":"verified","tileIds":["l0/5/7","l0/5/8","l0/6/7","l0/6/8","l0/7/7","l0/7/8"]},{"accuracyTier":"unrated","number":10,"par":5,"strokeIndex":18,"strokeIndexStatus":"verified","tileIds":["l0/6/8","l0/6/9","l0/7/8","l0/7/9","l0/8/8","l0/8/9"]},{"accuracyTier":"unrated","number":11,"par":4,"strokeIndex":4,"strokeIndexStatus":"verified","tileIds":["l0/7/9","l0/8/8","l0/8/9","l0/9/8","l0/9/9"]},{"accuracyTier":"unrated","number":12,"par":4,"strokeIndex":8,"strokeIndexStatus":"verified","tileIds":["l0/8/7","l0/8/8","l0/8/9","l0/9/7","l0/9/8","l0/9/9"]},{"accuracyTier":"unrated","number":13,"par":4,"strokeIndex":16,"strokeIndexStatus":"verified","tileIds":["l0/10/7","l0/10/8","l0/8/7","l0/8/8","l0/9/7","l0/9/8"]},{"accuracyTier":"unrated","number":14,"par":3,"strokeIndex":12,"strokeIndexStatus":"verified","tileIds":["l0/8/7","l0/9/7","l0/9/8"]},{"accuracyTier":"unrated","number":15,"par":4,"strokeIndex":2,"strokeIndexStatus":"verified","tileIds":["l0/7/6","l0/8/6","l0/8/7","l0/9/6","l0/9/7"]},{"accuracyTier":"unrated","number":16,"par":5,"strokeIndex":10,"strokeIndexStatus":"verified","tileIds":["l0/7/6","l0/7/7","l0/8/6","l0/8/7","l0/8/8"]},{"accuracyTier":"unrated","number":17,"par":3,"strokeIndex":14,"strokeIndexStatus":"verified","tileIds":["l0/7/8","l0/7/9","l0/8/8","l0/8/9"]},{"accuracyTier":"unrated","number":18,"par":5,"strokeIndex":6,"strokeIndexStatus":"verified","tileIds":["l0/6/8","l0/6/9","l0/7/8","l0/7/9","l0/8/8","l0/8/9"]}],"requiredFeatures":["chunk-envelope-v2","course-routing-json-v1","object-registry-json-v1","stand-field-u8-v1","terrain-grid-u16-v1"],"routing":{"bytes":1809,"decodedBytes":3182,"decodedSha256":"712a2d247ec9f82dd8fd4878e246ca809688d3c4f6e48948c1ea28be412ebad5","kind":"routing","mediaType":"application/vnd.banvy.chunk-v2","requiredFeatures":["chunk-envelope-v2","course-routing-json-v1"],"sha256":"ebebcad697ac2b52604d359b7b0466d966ee8d750f33ceafca769bee44c9f303","url":"courses/visby/routing/ebebcad697ac2b52604d359b7b0466d966ee8d750f33ceafca769bee44c9f303.bvch"},"schemaVersion":2,"slug":"visby"}