{"$schema":"packages/course-v2/schemas/course-v2.schema.json","courseFormat":2,"fallbackV1":{"bytes":697879,"format":1,"packUrl":"courses/upsala/pack.bin","sha256":"5b7dc97a9990c07b77139c5c53618ef344371d6cf789550808384ca947331e91"},"groundFormat":2,"groundId":"upsala","groundManifest":{"bytes":263314,"mediaType":"application/vnd.banvy.ground-manifest-v2+json","sha256":"df80f059000c7e103c7de33da75195169a28fbaee306dd7ccfa1f8de029b6c53","url":"grounds/upsala/ground-v2-df80f059000c7e103c7de33da75195169a28fbaee306dd7ccfa1f8de029b6c53.json"},"holes":[{"accuracyTier":"unrated","number":1,"par":4,"strokeIndex":7,"strokeIndexStatus":"verified","tileIds":["l0/2/3","l0/2/4","l0/3/3","l0/3/4","l0/4/3","l0/4/4"]},{"accuracyTier":"unrated","number":2,"par":3,"strokeIndex":17,"strokeIndexStatus":"verified","tileIds":["l0/3/3","l0/3/4","l0/4/3","l0/4/4"]},{"accuracyTier":"unrated","number":3,"par":4,"strokeIndex":5,"strokeIndexStatus":"verified","tileIds":["l0/3/3","l0/3/4","l0/4/3","l0/4/4","l0/4/5"]},{"accuracyTier":"unrated","number":4,"par":4,"strokeIndex":3,"strokeIndexStatus":"verified","tileIds":["l0/2/3","l0/2/4","l0/3/3","l0/3/4","l0/3/5","l0/4/4","l0/4/5"]},{"accuracyTier":"unrated","number":5,"par":5,"strokeIndex":13,"strokeIndexStatus":"verified","tileIds":["l0/2/3","l0/2/4","l0/2/5","l0/2/6","l0/3/3","l0/3/4","l0/3/5","l0/3/6"]},{"accuracyTier":"unrated","number":6,"par":3,"strokeIndex":9,"strokeIndexStatus":"verified","tileIds":["l0/1/5","l0/1/6","l0/2/5","l0/2/6"]},{"accuracyTier":"unrated","number":7,"par":4,"strokeIndex":1,"strokeIndexStatus":"verified","tileIds":["l0/0/4","l0/0/5","l0/1/4","l0/1/5","l0/1/6"]},{"accuracyTier":"unrated","number":8,"par":5,"strokeIndex":15,"strokeIndexStatus":"verified","tileIds":["l0/0/3","l0/0/4","l0/1/2","l0/1/3","l0/1/4","l0/2/2","l0/2/3"]},{"accuracyTier":"unrated","number":9,"par":4,"strokeIndex":11,"strokeIndexStatus":"verified","tileIds":["l0/2/1","l0/2/2","l0/2/3","l0/3/1","l0/3/2"]},{"accuracyTier":"unrated","number":10,"par":3,"strokeIndex":14,"strokeIndexStatus":"verified","tileIds":["l0/3/1","l0/3/2","l0/4/1","l0/4/2"]},{"accuracyTier":"unrated","number":11,"par":4,"strokeIndex":4,"strokeIndexStatus":"verified","tileIds":["l0/2/1","l0/2/2","l0/3/1","l0/3/2","l0/4/1","l0/4/2"]},{"accuracyTier":"unrated","number":12,"par":5,"strokeIndex":10,"strokeIndexStatus":"verified","tileIds":["l0/0/2","l0/0/3","l0/1/1","l0/1/2","l0/1/3","l0/2/1","l0/2/2"]},{"accuracyTier":"unrated","number":13,"par":4,"strokeIndex":12,"strokeIndexStatus":"verified","tileIds":["l0/0/2","l0/0/3","l0/1/2","l0/1/3","l0/2/2","l0/2/3"]},{"accuracyTier":"unrated","number":14,"par":3,"strokeIndex":16,"strokeIndexStatus":"verified","tileIds":["l0/1/1","l0/1/2","l0/1/3","l0/2/1","l0/2/2","l0/2/3"]},{"accuracyTier":"unrated","number":15,"par":4,"strokeIndex":2,"strokeIndexStatus":"verified","tileIds":["l0/1/2","l0/1/3","l0/1/4","l0/2/2","l0/2/3"]},{"accuracyTier":"unrated","number":16,"par":5,"strokeIndex":6,"strokeIndexStatus":"verified","tileIds":["l0/1/3","l0/1/4","l0/1/5","l0/1/6","l0/2/4","l0/2/5","l0/2/6"]},{"accuracyTier":"unrated","number":17,"par":4,"strokeIndex":18,"strokeIndexStatus":"verified","tileIds":["l0/1/5","l0/1/6","l0/2/4","l0/2/5","l0/2/6"]},{"accuracyTier":"unrated","number":18,"par":4,"strokeIndex":8,"strokeIndexStatus":"verified","tileIds":["l0/1/4","l0/1/5","l0/2/3","l0/2/4","l0/2/5","l0/3/3","l0/3/4"]}],"requiredFeatures":["chunk-envelope-v2","course-routing-json-v1","object-registry-json-v1","stand-field-u8-v1","terrain-grid-u16-v1"],"routing":{"bytes":2233,"decodedBytes":4057,"decodedSha256":"17b4565c8603b5339e02658674e6774e18425aebf4a98514fc9204fcdf2d0850","kind":"routing","mediaType":"application/vnd.banvy.chunk-v2","requiredFeatures":["chunk-envelope-v2","course-routing-json-v1"],"sha256":"add8fb9612c8d6652fabf88cf76825360a5aaf73fd928170d185ed7f79a91ffa","url":"courses/upsala/routing/add8fb9612c8d6652fabf88cf76825360a5aaf73fd928170d185ed7f79a91ffa.bvch"},"schemaVersion":2,"slug":"upsala"}