{"$schema":"packages/course-v2/schemas/course-v2.schema.json","courseFormat":2,"fallbackV1":{"bytes":452748,"format":1,"packUrl":"courses/visby/pack.bin","sha256":"32a8ec1e07082f2fe47ed274e061863cfbd5e6c0306f326734c91099abff9d30"},"groundFormat":2,"groundId":"visby","groundManifest":{"bytes":350324,"mediaType":"application/vnd.banvy.ground-manifest-v2+json","sha256":"82137bd40b2488fa64ad1c5039c92363178c3c0f6c4e9f9069b23d6569fd8910","url":"grounds/visby/ground-v2-82137bd40b2488fa64ad1c5039c92363178c3c0f6c4e9f9069b23d6569fd8910.json"},"holes":[{"accuracyTier":"unrated","number":1,"par":3,"strokeIndex":15,"strokeIndexStatus":"verified","tileIds":["l0/5/7","l0/5/8","l0/5/9","l0/6/7","l0/6/8","l0/6/9"]},{"accuracyTier":"unrated","number":2,"par":4,"strokeIndex":7,"strokeIndexStatus":"verified","tileIds":["l0/5/7","l0/5/8","l0/6/6","l0/6/7","l0/6/8"]},{"accuracyTier":"unrated","number":3,"par":5,"strokeIndex":5,"strokeIndexStatus":"verified","tileIds":["l0/6/4","l0/6/5","l0/6/6","l0/7/4","l0/7/5","l0/7/6"]},{"accuracyTier":"unrated","number":4,"par":4,"strokeIndex":13,"strokeIndexStatus":"verified","tileIds":["l0/6/3","l0/6/4","l0/7/3","l0/7/4","l0/7/5","l0/8/4","l0/8/5"]},{"accuracyTier":"unrated","number":5,"par":3,"strokeIndex":11,"strokeIndexStatus":"verified","tileIds":["l0/6/4","l0/6/5"]},{"accuracyTier":"unrated","number":6,"par":5,"strokeIndex":3,"strokeIndexStatus":"verified","tileIds":["l0/6/4","l0/6/5","l0/6/6","l0/6/7"]},{"accuracyTier":"unrated","number":7,"par":3,"strokeIndex":9,"strokeIndexStatus":"verified","tileIds":["l0/6/6","l0/6/7","l0/7/6","l0/7/7"]},{"accuracyTier":"unrated","number":8,"par":4,"strokeIndex":1,"strokeIndexStatus":"verified","tileIds":["l0/6/6","l0/6/7","l0/6/8","l0/7/6","l0/7/7"]},{"accuracyTier":"unrated","number":9,"par":4,"strokeIndex":17,"strokeIndexStatus":"verified","tileIds":["l0/5/7","l0/5/8","l0/6/7","l0/6/8","l0/7/7","l0/7/8"]},{"accuracyTier":"unrated","number":10,"par":5,"strokeIndex":18,"strokeIndexStatus":"verified","tileIds":["l0/6/8","l0/6/9","l0/7/8","l0/7/9","l0/8/8","l0/8/9"]},{"accuracyTier":"unrated","number":11,"par":4,"strokeIndex":4,"strokeIndexStatus":"verified","tileIds":["l0/7/9","l0/8/8","l0/8/9","l0/9/8","l0/9/9"]},{"accuracyTier":"unrated","number":12,"par":4,"strokeIndex":8,"strokeIndexStatus":"verified","tileIds":["l0/8/7","l0/8/8","l0/8/9","l0/9/7","l0/9/8","l0/9/9"]},{"accuracyTier":"unrated","number":13,"par":4,"strokeIndex":16,"strokeIndexStatus":"verified","tileIds":["l0/10/7","l0/10/8","l0/8/7","l0/8/8","l0/9/7","l0/9/8"]},{"accuracyTier":"unrated","number":14,"par":3,"strokeIndex":12,"strokeIndexStatus":"verified","tileIds":["l0/10/7","l0/10/8","l0/8/7","l0/9/7","l0/9/8"]},{"accuracyTier":"unrated","number":15,"par":4,"strokeIndex":2,"strokeIndexStatus":"verified","tileIds":["l0/7/6","l0/7/7","l0/8/6","l0/8/7","l0/9/6","l0/9/7"]},{"accuracyTier":"unrated","number":16,"par":5,"strokeIndex":10,"strokeIndexStatus":"verified","tileIds":["l0/7/6","l0/7/7","l0/8/6","l0/8/7","l0/8/8","l0/9/8"]},{"accuracyTier":"unrated","number":17,"par":3,"strokeIndex":14,"strokeIndexStatus":"verified","tileIds":["l0/7/8","l0/7/9","l0/8/8","l0/8/9"]},{"accuracyTier":"unrated","number":18,"par":5,"strokeIndex":6,"strokeIndexStatus":"verified","tileIds":["l0/5/8","l0/5/9","l0/6/8","l0/6/9","l0/7/8","l0/7/9","l0/8/8","l0/8/9"]}],"requiredFeatures":["chunk-envelope-v2","course-routing-json-v1","stand-field-u8-v1","terrain-grid-u16-v1"],"routing":{"bytes":1599,"decodedBytes":2942,"decodedSha256":"05a090c4753c1187ac5710f0b364b355c3db45ee2c499e35cbc2fca3026bcff8","kind":"routing","mediaType":"application/vnd.banvy.chunk-v2","requiredFeatures":["chunk-envelope-v2","course-routing-json-v1"],"sha256":"1feffbb64d377f792225fd271f56737fe86983de0a8272e290988614ccb8ce1a","url":"courses/visby/routing/1feffbb64d377f792225fd271f56737fe86983de0a8272e290988614ccb8ce1a.bvch"},"schemaVersion":2,"slug":"visby"}