{"$schema":"packages/course-v2/schemas/course-v2.schema.json","courseFormat":2,"fallbackV1":{"bytes":363125,"format":1,"packUrl":"courses/veckefjarden-korthalsbanan/pack.bin","sha256":"5643d9cbfc076226cc0806f30ad3f9d01d6432d33166d42a655a9d8a8381254e"},"groundFormat":2,"groundId":"veckefjarden","groundManifest":{"bytes":266838,"mediaType":"application/vnd.banvy.ground-manifest-v2+json","sha256":"70c25ba49fd4929fe83fd822801a982345656481dfb294cb85314e0910ca796a","url":"grounds/veckefjarden/ground-v2-70c25ba49fd4929fe83fd822801a982345656481dfb294cb85314e0910ca796a.json"},"holes":[{"accuracyTier":"unrated","number":1,"par":3,"strokeIndex":null,"strokeIndexStatus":"not-applicable","tileIds":["l0/4/4","l0/4/5","l0/5/4","l0/5/5"]},{"accuracyTier":"unrated","number":2,"par":3,"strokeIndex":null,"strokeIndexStatus":"not-applicable","tileIds":["l0/4/4","l0/4/5","l0/5/4","l0/5/5"]},{"accuracyTier":"unrated","number":3,"par":3,"strokeIndex":null,"strokeIndexStatus":"not-applicable","tileIds":["l0/3/5","l0/4/5"]},{"accuracyTier":"unrated","number":4,"par":3,"strokeIndex":null,"strokeIndexStatus":"not-applicable","tileIds":["l0/3/4","l0/3/5","l0/4/4","l0/4/5"]},{"accuracyTier":"unrated","number":5,"par":3,"strokeIndex":null,"strokeIndexStatus":"not-applicable","tileIds":["l0/3/4","l0/3/5","l0/4/4","l0/4/5"]},{"accuracyTier":"unrated","number":6,"par":3,"strokeIndex":null,"strokeIndexStatus":"not-applicable","tileIds":["l0/4/4","l0/5/4"]},{"accuracyTier":"unrated","number":7,"par":3,"strokeIndex":null,"strokeIndexStatus":"not-applicable","tileIds":["l0/4/4","l0/4/5"]},{"accuracyTier":"unrated","number":8,"par":3,"strokeIndex":null,"strokeIndexStatus":"not-applicable","tileIds":["l0/4/4","l0/4/5","l0/5/4","l0/5/5"]},{"accuracyTier":"unrated","number":9,"par":3,"strokeIndex":null,"strokeIndexStatus":"not-applicable","tileIds":["l0/4/4","l0/4/5","l0/5/4","l0/5/5"]}],"requiredFeatures":["chunk-envelope-v2","course-routing-json-v1","object-registry-json-v1","stand-field-u8-v1","terrain-grid-u16-v1"],"routing":{"bytes":1544,"decodedBytes":2215,"decodedSha256":"cd54eff120a8546dd507de1e3395f16cff65853002f589c2b49cc0d264ba31af","kind":"routing","mediaType":"application/vnd.banvy.chunk-v2","requiredFeatures":["chunk-envelope-v2","course-routing-json-v1"],"sha256":"9b8d2ca476dfb582a1c70ae7de7639cdc5726cf36f5e750c83d0a7cbdd370ad4","url":"courses/veckefjarden-korthalsbanan/routing/9b8d2ca476dfb582a1c70ae7de7639cdc5726cf36f5e750c83d0a7cbdd370ad4.bvch"},"schemaVersion":2,"slug":"veckefjarden-korthalsbanan"}